{
  "name": "adult_income",
  "index": 1,
  "title": "Adult Census Income (> 50k)",
  "source": {
    "kind": "adult"
  },
  "target": "target",
  "metric": "roc_auc",
  "budget": {
    "n_fits": 24,
    "per": "arm"
  },
  "allowed_models": [
    "logreg",
    "rf",
    "hgb"
  ],
  "test_rule": {
    "scores": 1,
    "after": "FREEZE"
  },
  "profile_keys": [
    "n_rows",
    "n_features",
    "n_classes",
    "imbalance",
    "has_categorical"
  ],
  "role": "curriculum",
  "why": "mixed numeric + categorical, class imbalance: the first lessons the pack learns (encoding, class_weight)"
}
