{
  "name": "synth_shift_a",
  "index": 5,
  "title": "Synthetic shifted table A (linear signal)",
  "source": {
    "kind": "synth",
    "n": 800,
    "seed": 5,
    "shift": 1,
    "imbalance": 0.4
  },
  "target": "target",
  "metric": "roc_auc",
  "budget": {
    "n_fits": 24,
    "per": "arm"
  },
  "allowed_models": [
    "logreg",
    "rf",
    "hgb"
  ],
  "test_rule": {
    "scores": 1,
    "after": "FREEZE"
  },
  "profile_keys": [
    "n_rows",
    "n_features",
    "n_classes",
    "imbalance",
    "has_categorical"
  ],
  "role": "curriculum",
  "why": "a table whose profile flips which recipe fields matter: the superstition test"
}
